{
  "schemaVersion": 1,
  "component": "example-app",
  "version": "1.0.0",
  "publishedAt": "2026-11-01T10:00:00Z",
  "expiresAt": "2027-05-01T10:00:00Z",
  "minimumVersion": "0.9.0",
  "notes": "",
  "requires": [
    {
      "component": "example-api",
      "range": ">=2.1.0-rc.1 <3.0.0"
    }
  ],
  "platforms": {
    "web": {
      "action": "reload"
    }
  }
}
